{
  "$schema": "http://json-schema.org/draft-07/schema#",
  "type": "array",
  "items": {
    "type": "object",
    "required": ["title", "source_url", "date_made", "sector"],
    "additionalProperties": false,
    "properties": {
      "title": { "type": "string", "minLength": 1 },
      "description": { "type": "string" },
      "author": { "type": ["string", "null"] },
      "source_url": { "type": "string", "format": "uri" },
      "date_made": { "type": "string", "format": "date" },
      "sector": { "$ref": "sector-slug" }
    }
  }
}