[
  {
    "title": "الحكومة السورية الانتقالية بعد عام على تشكيلها",
    "description": "تتناول هذه الورقة تحليلاً لأداء الحكومة السورية الانتقالية بعد عام على تشكيلها في آذار 2025 وتغطي الدراسة الأداء في مختلف المجالات والتحديات التي واجهة الحكومة بالإضافة لتقديم مجموعة من التوصيات لتعزيز فرص نجاح المرحلة الانتقالية.",
    "author": "المركز العربي لدراسات سوريا المعاصرة",
    "source_url": "https://damascusinstitute.org/researches/%D8%A7%D9%84%D8%AD%D9%83%D9%88%D9%85%D8%A9-%D8%A7%D9%84%D8%B3%D9%88%D8%B1%D9%8A%D8%A9-%D8%A7%D9%84%D8%A7%D9%86%D8%AA%D9%82%D8%A7%D9%84%D9%8A%D8%A9-%D8%A8%D8%B9%D8%AF-%D8%B9%D8%A7%D9%85-%D8%B9%D9%84/",
    "date_made": "2026-04-09",
    "sector": "administration"
  },
  {
    "title": "رؤية الشَّبكة السورية لحقوق الإنسان عن العدالة الانتقالية في سوريا",
    "description": "تقرير مفصل من الشبكة السورية لحقوق الإنسان يستعرض رؤيتها لتحقيق العدالة الانتقالية في سوريا ومحاسبة المسؤولين عن الانتهاكات.",
    "author": "الشبكة السورية لحقوق الإنسان SNHR",
    "source_url": "https://snhr.org/arabic/2025/04/17/%d8%b1%d8%a4%d9%8a%d8%a9-%d8%a7%d9%84%d8%b4%d9%8e%d9%91%d8%a8%d9%83%d8%a9-%d8%a7%d9%84%d8%b3%d9%88%d8%b1%d9%8a%d8%a9-%d9%84%d8%ad%d9%82%d9%88%d9%82-%d8%a7%d9%84%d8%a5%d9%86%d8%b3%d8%a7%d9%86-%d8%b9/",
    "date_made": "2025-04-17",
    "sector": "justice"
  }
]
